{
  "uuid": "ad8fefaa8351454bb739a4eaa872173f",
  "commission_data": {
    "visits": {},
    "completed": {},
    "total_completed": 42,
    "unique_npcs_served": 42
  },
  "composter_data": {},
  "active_commissions": {},
  "resources_collected": {},
  "crop_upgrade_levels": {},
  "unlocked_plots_ids": [
    "500123"
  ],
  "garden_experience": 42,
  "unlocked_barn_skins": [
    "example"
  ],
  "selected_barn_skin": "example"
}